{
  "chapter_id": "ch00_cold_open",
  "chapter_index": 0,
  "title_display": "Cold Open",
  "year_range": [1835],
  "duration_s": 45,
  "vo_start_offset_in_master_s": 0,
  "outgoing_state": {
    "basemap_tier": "continental",
    "active_pins": ["pin_washington_dc"],
    "year_display": 1835
  },
  "phases": [
    {
      "phase_id": "p0_cold_open",
      "phase_kind": "cold_open",
      "duration_s": 20,
      "beats": [
        {
          "beat_id": "b0_open",
          "intent": "Establish the year over a continental map.",
          "start_anchor": {"phrase": "eighteen thirty five"},
          "end_anchor": {"phrase": "the capital"},
          "layers": [
            {"layer": "L0", "primitive": "basemap_swap"},
            {"layer": "L10", "primitive": "year_card_update"}
          ]
        },
        {
          "beat_id": "b1_pin",
          "intent": "Drop the Washington pin as the city is named.",
          "start_anchor": {"phrase": "Washington", "offset_ms": -120},
          "end_anchor": {"phrase": "the Capitol rotunda"},
          "layers": [
            {"layer": "L4", "primitive": "pin_drop", "anchor_id": "pin_washington_dc"}
          ]
        }
      ]
    },
    {
      "phase_id": "p1_map_breath",
      "phase_kind": "map_breath",
      "duration_s": 25,
      "beats": [
        {
          "beat_id": "b2_breath",
          "intent": "Slow breath on the establishing wide. The end is an instrumental sting (not a spoken word), so the end_anchor is a DELIBERATELY-MARKED structural stub: it resolves only via fallback_absolute_s but carries fallback_reason, which qa_drift downgrades to a non-blocking WARN even though a VO transcript exists.",
          "start_anchor": {"phrase": "a young nation"},
          "end_anchor": {"phrase": "instrumental sting", "fallback_absolute_s": 16.4, "fallback_reason": "no_vo_yet_structural_test"},
          "layers": [
            {"layer": "L7", "primitive": "camera_hold"}
          ]
        }
      ]
    }
  ]
}
