{
  "chapter_id": "ch02_garfield",
  "chapter_index": 2,
  "duration_s": 100,
  "incoming_state": {
    "basemap_tier": "continental",
    "active_pins": ["pin_fords_theatre"],
    "year_display": 1865
  },
  "outgoing_state": {
    "basemap_tier": "continental",
    "active_pins": ["pin_baltimore_potomac"],
    "year_display": 1881
  },
  "phases": [
    {
      "phase_id": "p_climax",
      "phase_kind": "climax",
      "duration_s": 8,
      "beats": [
        {
          "beat_id": "b_shot",
          "start_anchor": {"phrase": "the depot", "fallback_absolute_s": 2.0},
          "end_anchor": {"phrase": "two shots", "fallback_absolute_s": 6.0},
          "layers": [
            {"layer": "L9", "primitive": "gunshot_freeze"}
          ]
        }
      ]
    },
    {
      "phase_id": "p_return",
      "phase_kind": "return_to_map",
      "duration_s": 6,
      "beats": [
        {
          "beat_id": "b_spine",
          "intent": "Same recurring all-presidents map; Garfield now in color.",
          "start_anchor": {"phrase": "another pin", "fallback_absolute_s": 90.0},
          "end_anchor": {"phrase": "still to come", "fallback_absolute_s": 96.0},
          "layers": [
            {
              "layer": "L4",
              "primitive": "all_presidents_pins",
              "params": {
                "current": "pin_garfield",
                "pins": [
                  {"id": "pin_kennedy", "anchor_id": "anc_dallas"},
                  {"id": "pin_lincoln", "anchor_id": "anc_dc"},
                  {"id": "pin_mckinley", "anchor_id": "anc_buffalo"},
                  {"id": "pin_garfield", "anchor_id": "anc_dc"}
                ]
              }
            }
          ]
        }
      ]
    }
  ]
}
