{
  "chapter_id": "ch02_aftermath",
  "chapter_index": 2,
  "title_display": "Aftermath",
  "year_range": [1835, 1837],
  "duration_s": 90,
  "incoming_state": {
    "basemap_tier": "urban",
    "active_pins": ["pin_capitol", "pin_washington_dc"],
    "dimmed_pins": ["pin_washington_dc"],
    "year_display": 1835,
    "weather": "clear",
    "time_of_day": "night",
    "active_ui_furniture": ["chapter_timeline", "year_card"],
    "chapter_subject_id": "subj_jackson"
  },
  "outgoing_state": {
    "basemap_tier": "continental",
    "active_pins": ["pin_washington_dc", "pin_capitol"],
    "dimmed_pins": ["pin_washington_dc", "pin_capitol"],
    "year_display": 1837,
    "weather": "clear",
    "time_of_day": "night",
    "active_ui_furniture": ["year_card"],
    "chapter_subject_id": null
  },
  "phases": [
    {
      "phase_id": "p0_aftermath",
      "phase_kind": "aftermath",
      "duration_s": 50,
      "beats": [
        {
          "beat_id": "b0",
          "start_anchor": {"phrase": "the attempt failed"},
          "end_anchor": {"phrase": "years passed"},
          "layers": [
            {"layer": "L4", "primitive": "pin_dimming", "anchor_id": "pin_capitol"}
          ]
        }
      ]
    },
    {
      "phase_id": "p1_return_to_map",
      "phase_kind": "return_to_map",
      "duration_s": 40,
      "beats": [
        {
          "beat_id": "b1",
          "start_anchor": {"phrase": "the nation moved on"},
          "end_anchor": {"phrase": "eighteen thirty seven"},
          "layers": [
            {"layer": "L0", "primitive": "camera_pull_out"},
            {"layer": "L10", "primitive": "year_sweep"}
          ]
        }
      ]
    }
  ]
}
